,text,capital,report
259,"As a Delaware corporation, we are also subject to certain Delaware anti-takeover provisions.",Social and relationship,report3_SHW
7,"As of December 31, 2020, we had gross unrecognized tax benefits of $140 million, of which $38 million was classified in “Other non-current liabilities” and $54 million as a reduction to deferred tax assets which was classified as ""Other non-current assets"" in the Consolidated Balance Sheets.",Financial,report3_SHW
482,"If we are not successful in maintaining existing and creating new relationships, or if we encounter technological, content licensing, regulatory, business or other impediments to delivering our streaming content to our members via these devices, our ability to retain members and grow our business could be adversely impacted.",Social and relationship,report3_SHW
132,"The contractual obligations table above does not include any estimated obligation for the unknown future titles, payment for which could range from less than one year to more than five years.",Social and relationship,report3_SHW
120,"The preparation of consolidated financial statements in conformity with accounting principles generally accepted in the United States of America requires management to make estimates and assumptions that affect the reported amounts of assets and liabilities, disclosures of contingent assets and liabilities at the date of the financial statements, and the reported amounts of revenues and expenses during the reported periods.",Human,report3_SHW
8,(3)See Note 5 Balance Sheet Components in the accompanying notes to our consolidated financial statements for further details regarding leases.,Financial,report3_SHW
581,"If any portion of the benefit is unused, the employee is paid the unused benefit as cash compensation, up to $5,000.",Human,report3_SHW
368,"Our reputation and relationships with members would be harmed if member personal information and other data, particularly billing data, were to be accessed by unauthorized persons.",Social and relationship,report3_SHW
97,Deferred income taxes are recognized by applying enacted statutory tax rates applicable to future years to differences between the financial statement carrying amounts of existing assets and liabilities and their respective tax bases as well as net operating loss and tax credit carryforwards.,Financial,report3_SHW
336,"In addition, we have entered into a revolving credit agreement that provides for a $750 million unsecured revolving credit facility.",Financial,report3_SHW
154,"We believe free cash flow is an important liquidity metric because it measures, during a given period, the amount of cash generated that is available to repay debt obligations, make strategic acquisitions and investments and for certain other activities like share repurchases.",Financial,report3_SHW
622,"We use the intellectual property of third parties in creating some of our content, merchandising our products and marketing our service.",Intellectual,report3_SHW
262,"•authorize our board of directors, without stockholder approval, to issue up to 10,000,000 shares of undesignated preferred stock;",Human,report3_SHW
296,"•adverse tax consequences such as those related to changes in tax laws or tax rates or their interpretations, and the related application of judgment in determining our global provision for income taxes, deferred tax assets or liabilities or other tax liabilities given the ultimate tax determination is uncertain;",Financial,report3_SHW
562,"To the extent the resulting economic disruption is severe, we could see some vendors go out of business, resulting in supply constraints and increased costs or delays to our productions.",Social and relationship,report3_SHW
559,"The full extent to which the COVID-19 pandemic and the various responses to it impacts our business, operations and financial results will depend on numerous evolving factors that we may not be able to accurately predict, including: the duration and scope of the pandemic; governmental, business and individuals’ actions that have been and continue to be taken in response to the pandemic; the availability and cost to access the capital markets; the effect on our customers and customer demand for and ability to pay for our services; disruptions or restrictions on our employees’ ability to work and travel; and any stoppages, disruptions or increased costs associated with our development, production, post-production, marketing and distribution of original programming.",Financial,report3_SHW
291,"•censorship requirements that cause us to remove or edit popular content, leading to consumer disappointment, brand tarnishment or dissatisfaction with our service;",Social and relationship,report3_SHW
15,"Interest and other income (expense) decreased primarily due to foreign exchange losses of $660 million for the year ended December 31, 2020 as compared to a gain of $7 million for the year ended December 31, 2019.",Financial,report3_SHW
610,"We also have a number of employees engaged in content production, some of whom are part-time or temporary, and whose numbers fluctuate throughout the year.",Human,report3_SHW
147,"Net cash provided by operating activities increased $5,314 million from the year ended December 31, 2019 to $2,427 million for the year ended December 31, 2020 primarily driven by a $4,840 million or 24% increase in revenues coupled with a decrease in cash payments for content assets.",Financial,report3_SHW
365,"With respect to billing information, such as credit card numbers, we rely on encryption and authentication technology to secure such information.",Manufactured,report3_SHW
574,"If any of the following risks actually occur, our business, financial condition and results of operations could be harmed.",Financial,report3_SHW
427,"Our intellectual property rights extend to our technology, business processes and the content we produce and distribute through our service.",Intellectual,report3_SHW
345,"From time to time, we may seek to obtain additional capital, either through equity, equity-linked or debt securities.",Financial,report3_SHW
303,•the need to adapt our content and user interfaces for specific cultural and language differences;,Social and relationship,report3_SHW
26,"•variations between our actual operating results and the expectations of securities analysts, investors and the financial community;",Financial,report3_SHW
189,General and administrative expenses consist of payroll and related expenses for corporate personnel.,Financial,report3_SHW
602,"Fostering a work environment that is culturally diverse, inclusive and equitable is a major focus for us.",Human,report3_SHW
438,"If our trademarks and other proprietary rights are not adequately protected to prevent use or appropriation by our competitors, the value of our brand and other intangible assets may be diminished, and our business may be adversely affected.",Intellectual,report3_SHW
418,"As a result of a dispute, we may have to develop non-infringing technology, enter into royalty or licensing agreements, adjust our content, merchandising or marketing activities or take other actions to resolve the claims.",Intellectual,report3_SHW
408,"However, to date these unauthorized releases have not had a material impact on our service, systems or business.",Manufactured,report3_SHW
613,Some even restrict the extent of ownership rights we can have both in our service and in our content.,Intellectual,report3_SHW
558,"During the COVID-19 crisis, we may not be able to provide the same level of customer service and product features that our members are used to which could negatively impact their perception of our service resulting in an increase in cancellations.",Social and relationship,report3_SHW
556,"It is not clear what the potential effects any such alterations or modifications may have on our business, including the effects on our customers, suppliers or vendors, or on our financial results.",Financial,report3_SHW
385,"Any harm to our members’ personal computers or other devices caused by software used in our operations could have an adverse effect on our business, results of operations and financial condition.",Manufactured,report3_SHW
494,Companies that promote our service may decide that we negatively impact their business or may make business decisions that in turn negatively impact us.,Social and relationship,report3_SHW
543,"While we permit multiple users within the same household to share a single account for non-commercial purposes, if multi-household usage is abused or if our efforts to restrict multi-household usage are ineffective, our ability to add new members may be hindered and our results of operations may be adversely impacted.",Financial,report3_SHW
601,"We employ a team reporting to our VP of Inclusion Strategy who works to build diversity, inclusion and equity into all aspects of our operations globally, with the goal of having diversity and inclusion function as a critical lens through which each Netflix employee carries out their role.",Human,report3_SHW
441,"Additionally, pending and ongoing litigation as well as negotiations between certain CMOs and other third parties in various territories could adversely impact our negotiations with CMOs, or result in music publishers represented by certain CMOs unilaterally withdrawing rights, and thereby adversely impact our ability to reach licensing agreements reasonably acceptable to us.",Social and relationship,report3_SHW
528,Companies also may enter into business combinations or alliances that strengthen their competitive positions.,Social and relationship,report3_SHW
95,"Although we believe our assumptions, judgments and estimates are reasonable, changes in tax laws or our interpretation of tax laws and the resolution of any tax audits could significantly impact the amounts provided for income taxes in our consolidated financial statements.",Financial,report3_SHW
184,"Interest expense for the year ended December 31, 2020 consisted primarily of $749 million of interest on our Notes.",Financial,report3_SHW
583,We care about the health and well-being of our employees and their families.,Human,report3_SHW
171,Liquidity and Capital Resources,Financial,report3_SHW
485,"In many instances, our agreements also include provisions by which the partner bills consumers directly for the Netflix service or otherwise offers services or products in connection with offering our service.",Social and relationship,report3_SHW
138,"The following table summarizes our contractual obligations at December 31, 2020:",Social and relationship,report3_SHW
387,"We also utilize third-party technology to help market our service, process payments, and otherwise manage the daily operations of our business.",Social and relationship,report3_SHW
188,General and administrative expenses also include professional fees and other general corporate expenses.,Financial,report3_SHW
411,"These systems periodically experience directed attacks intended to lead to interruptions and delays in our service and operations as well as loss, misuse or theft of personal information and other data, confidential information or intellectual property.",Intellectual,report3_SHW
380,Most network operators that provide consumers with access to the internet also provide these consumers with multichannel video programming.,Manufactured,report3_SHW
401,"In addition, we utilize third-party “cloud” computing services in connection with our business operations.",Manufactured,report3_SHW
267,"If expiring collective bargaining agreements cannot be renewed, then it is possible that the affected unions could take action in the form of strikes or work stoppages.",Human,report3_SHW
160,"Our primary uses of cash include the acquisition, licensing and production of content, streaming delivery, marketing programs and personnel-related costs.",Financial,report3_SHW
238,"From time to time, we are subject to litigation or claims that could negatively affect our business operations and financial position.",Financial,report3_SHW
10,"Certain agreements include the obligation to license rights for unknown future titles, the ultimate quantity and/or fees for which are not yet determinable as of the reporting date.",Social and relationship,report3_SHW
470,"In addition, from time to time, we encounter fraudulent use of payment methods, which could impact our results of operations and if not adequately controlled and managed could create negative consumer perceptions of our service.",Social and relationship,report3_SHW
323,Our streaming obligations include large multi-year commitments.,Social and relationship,report3_SHW
489,"To the extent we promote our content or service inefficiently or ineffectively, we may not obtain the expected acquisition and retention benefits and our business may be adversely affected.",Social and relationship,report3_SHW
239,We are engaged in legal proceedings that could cause us to incur unforeseen expenses and could occupy a significant amount of our management's time and attention.,Human,report3_SHW
103,Our business model is subscription based as opposed to a model generating revenues at a specific title level.,Financial,report3_SHW
564,"Other partners have similarly had their operations disrupted, including those partners that we use for our operations as well as development, production and post-production of content.",Social and relationship,report3_SHW
448,"As we seek to differentiate our service, we are often focused on securing certain exclusive rights when obtaining content, including original content.",Intellectual,report3_SHW
286,"•implementation of regulations designed to stimulate the local production of film and TV series in order to promote and preserve local culture and economic activity, including local content quotas, investment obligations, and levies to support local film funds.",Social and relationship,report3_SHW
48,"From time to time, third parties allege that we have violated their intellectual property rights.",Intellectual,report3_SHW
449,"As competition increases, we see the cost of certain programming increase.",Financial,report3_SHW
199,We have built our own global content delivery network (“Open Connect”) to help us efficiently stream a high volume of content to our members over the internet.,Manufactured,report3_SHW
19,"The increase in cost of revenues for the year ended December 31, 2020 as compared to the year ended December 31, 2019 was primarily due to a $1,591 million increase in content amortization relating to our existing and new content, including more exclusive and original programming.",Financial,report3_SHW
114,"We acquire, license and produce content, including original programming, in order to offer our members unlimited viewing of video entertainment.",Social and relationship,report3_SHW
44,"We have implemented certain systems and processes to thwart hackers and protect our data and systems, but the techniques used to gain unauthorized access to data and software are constantly evolving, and we may be unable to anticipate or prevent unauthorized access.",Manufactured,report3_SHW
164,We may not be able to obtain such financing on terms acceptable to us or at all.,Financial,report3_SHW
203,"In order to exclude the effect of foreign currency rate fluctuations on average monthly revenue per paying membership, we estimate current period revenue assuming foreign exchange rates had remained constant with foreign exchange rates from each of the corresponding months of the prior-year period.",Financial,report3_SHW
310,"If our cash flows are insufficient to fund our debt and other obligations and we are unable to refinance or restructure these obligations, we could face substantial liquidity problems and may be forced to reduce or delay investments and capital expenditures, or to sell material assets or operations to meet our debt and other obligations.",Social and relationship,report3_SHW
146,"The payments for content assets decreased $2,074 million, from $14,611 million to $12,537 million, or 14%, as compared to the increase in the amortization of content assets of $1,591 million, from $9,216 million to $10,807 million, or 17%.",Financial,report3_SHW
213,"The following tables summarize streaming revenue and other streaming membership information by region for the years ended December 31, 2020, 2019 and 2018.",Financial,report3_SHW
463,"We anticipate that several jurisdictions may, over time, impose greater financial and regulatory obligations on us.",Financial,report3_SHW
560,Temporary production pauses or permanent shutdowns in production could result in content asset impairments or other charges and will change the timing and amount of cash outflows associated with production activity.,Financial,report3_SHW
318,"Under our revolving credit agreement, in the event of the discontinuance of the LIBO Rate, a mutually agreed-upon alternate benchmark rate will be established to replace the LIBO Rate.",Social and relationship,report3_SHW
278,New laws and interpretations of the law are taken into account for financial statement purposes in the quarter or year that they become applicable.,Financial,report3_SHW
381,"Furthermore, to the extent network operators create tiers of internet access service and either charge us for or prohibit us from being available through these tiers, our business could be negatively impacted.",Social and relationship,report3_SHW
49,"Because of these provisions as well as other actions we may take, content available through our service can be withdrawn on short notice.",Social and relationship,report3_SHW
284,"Our failure to manage any of these risks successfully could harm our international operations and our overall business, and results of our operations.",Financial,report3_SHW
444,Music and certain authors’ performances contained within content we distribute may require us to obtain licenses for such distribution.,Intellectual,report3_SHW
228,"The increase in average monthly revenue per paying membership resulted from our price changes and plan mix, partially offset by unfavorable fluctuations in foreign exchange rates.",Financial,report3_SHW
148,"As a result, the timing of certain production payments has been and will continue to be delayed until productions can resume and may be shifted to future years.",Financial,report3_SHW
540,"Further, if excessive numbers of members cancel our service, we may be required to incur significantly higher marketing expenditures than we currently anticipate to replace these members with new members.",Financial,report3_SHW
130,The foregoing range is based on considerable management judgments and the actual amounts may differ.,Human,report3_SHW
425,"If we are unable to obtain sufficient rights, successfully defend our use, or develop non-infringing technology or otherwise alter our business practices on a timely basis in response to claims against us for infringement, misappropriation, misuse or other violation of third-party intellectual property rights, our business and competitive position may be adversely affected.",Intellectual,report3_SHW
162,"As our cash provided by operating activities grows and exceeds our minimum cash needs, our future capital allocation may include stock repurchase programs.",Financial,report3_SHW
124,"These contracts are primarily related to streaming delivery and cloud computing costs, as well as other miscellaneous open purchase orders for which we have not received the related services or goods.",Social and relationship,report3_SHW
205,"Memberships are assigned to territories based on the geographic location used at time of sign-up as determined by the Company’s internal systems, which utilize industry standard geo-location technology.",Manufactured,report3_SHW
218,"It is not clear what the potential effects any such alterations or modifications may have on our business, including the effects on our customers, suppliers or vendors, or on our financial results.",Social and relationship,report3_SHW
593,"We employ a VP of Leadership Programs, whose team’s mission is to design programs, such as seminars and lectures, that help our leaders (officers, VPs and director-level employees) examine values that guide them personally, and as leaders, especially when those values come into tension with the world around us.",Human,report3_SHW
187,"The increase in general and administrative expenses for the year ended December 31, 2020 as compared to the year ended December 31, 2019 was primarily due to a $128 million increase in personnel-related costs, including increases in compensation for existing employees and growth in average headcount to support the increase in our production activity and continued improvements in our streaming service.",Human,report3_SHW
63,We view our employees and our culture as key to our success.,Human,report3_SHW
407,There is no assurance that hackers may not have a material impact on our service or systems in the future.,Manufactured,report3_SHW
506,"If we are not able to manage the growing complexity of our business, including improving, refining or revising our systems and operational practices related to our streaming operations and original content, our business may be adversely affected.",Human,report3_SHW
618,We cannot provide assurance that we will prevail in any intellectual property disputes.,Intellectual,report3_SHW
261,•prohibit our stockholders from acting by written consent;,Human,report3_SHW
525,"As a producer and distributor of content, we face potential liability for negligence, copyright and trademark infringement, or other claims based on the nature and content of materials that we acquire, produce, license and/or distribute.",Intellectual,report3_SHW
33,•low usage and/or penetration of internet-connected consumer electronic devices;,Social and relationship,report3_SHW
375,Privacy concerns could limit our ability to collect and leverage member personal information and other data and disclosure of member personal information and other data could adversely impact our business and reputation.,Social and relationship,report3_SHW
64,We believe a critical component of our success is our company culture.,Human,report3_SHW
509,"As we scale our original content production, we are building out expertise in a number of disciplines, including creative, marketing, legal, finance, licensing, merchandising and other resources related to the development and physical production of content.",Human,report3_SHW
67,Our continued international expansion increases our exposure to exchange rate fluctuations and as a result such fluctuations could have a significant impact on our future results of operations.,Financial,report3_SHW
582,"Each employee receives an annual cash health benefit allowance that they may allocate to medical, dental and vision premiums in a way that makes sense for them.",Human,report3_SHW
399,"Problems faced by us or our third-party “cloud” computing or other network providers, including technological or business-related disruptions, as well as cybersecurity threats and regulatory interference, could adversely impact the experience of our members.",Manufactured,report3_SHW
134,"Once a title becomes available, a content liability is recorded on the Consolidated Balance Sheets.",Intellectual,report3_SHW
297,"•foreign intellectual property laws, such as the EU copyright directive, or changes to such laws, which may be less favorable than U.S. law and, among other issues, may impact the economics of creating or distributing content, anti-piracy efforts, or our ability to protect or exploit intellectual property rights;",Intellectual,report3_SHW
349,"Payment terms for certain content commitments, such as content we directly produce, will typically require more up-front cash payments than other content licenses or arrangements whereby we do not cashflow the production of such content.",Financial,report3_SHW
435,We have filed and we expect to file from time to time for trademark and patent applications.,Intellectual,report3_SHW
276,"If U.S. or other foreign tax authorities change applicable tax laws, our overall taxes could increase, and our business, financial condition or results of operations may be adversely impacted.",Financial,report3_SHW
197,"Marketing expenses consist primarily of advertising expenses and certain payments made to our marketing partners, including consumer electronics (""CE"") manufacturers, MVPDs, mobile operators and ISPs.",Financial,report3_SHW
460,"Changes in laws or regulations that adversely affect the growth, popularity or use of the internet, including laws impacting net neutrality, could decrease the demand for our service and increase our cost of doing business.",Financial,report3_SHW
0,"In addition, the effect of exchange rate changes on cash and cash equivalents in the year ended December 31, 2020 was an increase of $36 million.",Financial,report3_SHW
176,"As a result, we evaluated our ability to realize the California R&D credit, and considered all available positive and negative evidence, including operating results, ongoing tax planning, and forecasts of future taxable income and determined it is more likely than not that the pre-2020 credits and a portion of the current year R&D credit would not be realized.",Financial,report3_SHW
127,"As of December 31, 2020, the Company has additional operating leases for real estate that have not yet commenced of $256 million which has been included above.",Financial,report3_SHW
327,•require us to use a substantial portion of our cash flow from operations to make debt service payments and pay our other obligations when due;,Financial,report3_SHW
315,"For several years prior to 2020, our cash flows from operations were negative.",Financial,report3_SHW
