,text,capital,report
491,"Under our A2Z Guarantee, we reimburse buyers for payments up to certain limits in these situations, and as our third-party seller sales grow, the cost of this program will increase and could negatively affect our operating results.",Intellectual,report4_LMT
408,"We may not be able to implement, maintain, and develop the components of these commercial relationships, which may include web services, fulfillment, customer service, inventory management, tax collection, payment processing, hardware, content, and third-party software, and engaging third parties to perform services.",Social and relationship,report4_LMT
569,"We focus on investment and innovation, inclusion and diversity, safety, and engagement to hire and develop the best talent.",Human,report4_LMT
411,"We provide physical, e-commerce, and omnichannel retail and other services to businesses through commercial agreements, strategic alliances, and business relationships.",Social and relationship,report4_LMT
584,"We also offer programs that allow authors, musicians, filmmakers, skill and app developers, and others to publish and sell content.",Social and relationship,report4_LMT
340,"Until the final resolution of such matters, we may be exposed to losses in excess of the amount recorded, and such amounts could be material.",Financial,report4_LMT
421,The Loss of Key Senior Management Personnel or the Failure to Hire and Retain Highly Skilled and Other Key Personnel Could Negatively Affect Our Business,Human,report4_LMT
335,Third parties who sell products using our services and stores also expose us to product liability claims.,Social and relationship,report4_LMT
462,"A softening of demand, whether caused by changes in customer preferences or a weakening of the U.S. or global economies, may result in decreased revenue or growth.",Financial,report4_LMT
440,We and our co-sourcers may be unable to adequately staff our fulfillment network and customer service centers.,Social and relationship,report4_LMT
498,"As a result of holiday sales, as of December 31 of each year, our cash, cash equivalents, and marketable securities balances typically reach their highest level (other than as a result of cash flows provided by or used in investing and financing activities).",Financial,report4_LMT
443,"As we continue to add fulfillment and data center capability or add new businesses with different requirements, our fulfillment and data center networks become increasingly complex and operating them becomes more challenging.",Intellectual,report4_LMT
495,The law relating to the liability of online service providers is currently unsettled.,Social and relationship,report4_LMT
69,"In addition, valuations supporting our acquisitions and strategic investments could change rapidly.",Financial,report4_LMT
163,"See Item 8 of Part II, “Financial Statements and Supplementary Data — Note 4 — Leases and Note 6 — Debt” for additional information.",Financial,report4_LMT
474,"Due to these fluctuations, operating results may differ materially from expectations, and we may record significant gains or losses on the remeasurement of intercompany balances.",Financial,report4_LMT
152,We provide multiple measures of free cash flows because we believe these measures provide additional perspective on the impact of acquiring property and equipment with cash and through finance leases and financing obligations.,Financial,report4_LMT
432,"We use third-party technology and systems for a variety of reasons, including, without limitation, encryption and authentication technology, employee email, content delivery to customers, back-office support, and other functions.",Intellectual,report4_LMT
113,"Upon consolidation, as foreign exchange rates vary, net sales and other operating results may differ materially from expectations, and we may record significant gains or losses on the remeasurement of intercompany balances.",Financial,report4_LMT
338,"In addition, it is possible that a resolution of one or more such proceedings, including as a result of a settlement, could involve licenses, sanctions, consent decrees, or orders requiring us to make substantial future payments, preventing us from offering certain products or services, requiring us to change our business practices in a manner materially adverse to our business, requiring development of non-infringing or otherwise altered products or technologies, damaging our reputation, or otherwise having a material effect on our operations.",Financial,report4_LMT
166,"Our interest income corresponds with the average balance of invested funds based on the prevailing rates, which vary depending on the geographies and currencies in which they are invested.",Financial,report4_LMT
539,"As a result of competition, our product and service offerings may not be successful, we may fail to gain or may lose business, and we may be required to increase our spending or lower prices, any of which could materially reduce our sales and profits.",Financial,report4_LMT
400,•impairment of other relationships;,Social and relationship,report4_LMT
379,We could determine that such valuations have experienced impairments or other-than-temporary declines in fair value which could adversely impact our financial results.,Financial,report4_LMT
296,"To best take advantage of these continued advances in technology, we are investing in AWS, which offers a broad set of on-demand technology services, including compute, storage, database, analytics, and machine learning, and other services, to developers and enterprises of all sizes.",Intellectual,report4_LMT
140,"Information regarding the effect of foreign exchange rates, versus the U.S. Dollar, on our net sales, operating expenses, and operating income is provided to show reported period operating results had the foreign exchange rates remained the same as those in effect in the comparable prior year periods.",Financial,report4_LMT
200,Information about operating expenses is as follows (in millions):,Financial,report4_LMT
6,"Free cash flow less equipment finance leases and principal repayments of all other finance leases and financing obligations is free cash flow reduced by equipment acquired under finance leases, which is included in “Property and equipment acquired under finance leases,” principal repayments of all other finance lease liabilities, which is included in “Principal repayments of finance leases,” and “Principal repayments of financing obligations.” All other finance lease liabilities and financing obligations consists of property.",Financial,report4_LMT
393,•problems retaining key personnel;,Human,report4_LMT
527,"•restrictions on sales or distribution of certain products or services and uncertainty regarding liability for products, services, and content, including uncertainty as a result of less Internet-friendly legal systems, local laws, lack of legal precedent, and varying rules, regulations, and practices regarding the physical and digital distribution of media products and enforcement of intellectual property rights;",Financial,report4_LMT
413,"In addition, violations by our suppliers or other vendors of applicable laws, regulations, contractual terms, intellectual property rights of others, or our Supply Chain Standards, as well as products or practices regarded as unethical, unsafe, or hazardous, could expose us to claims, damage our reputation, limit our growth, and negatively affect our operating results.",Social and relationship,report4_LMT
201,Changes in foreign exchange rates impacted operating income by $273 million and $30 million for 2019 and 2020.,Financial,report4_LMT
74,•our ability to collect amounts owed to us when they become due;,Financial,report4_LMT
596,We design our stores to enable hundreds of millions of unique products to be sold by us and by third parties across dozens of product categories.,Social and relationship,report4_LMT
272,There are many transactions that occur during the ordinary course of business for which the ultimate tax determination is uncertain.,Financial,report4_LMT
233,"However, due to the rapidly evolving global situation, it is not possible to predict whether unanticipated consequences of the pandemic are reasonably likely to materially affect our liquidity and capital resources in the future.",Financial,report4_LMT
251,"As of December 31, 2020, cash, cash equivalents, and marketable securities held by foreign subsidiaries were $17.2 billion.",Financial,report4_LMT
261,"Our operating cash flows result primarily from cash received from our consumer, seller, developer, enterprise, and content creator customers, and advertisers, offset by cash payments we make for products and services, employee compensation, payment processing and related transaction costs, operating leases, and interest payments on our long-term obligations.",Financial,report4_LMT
561,Mr. Bezos has been Chairman of the Board of Amazon.com since founding it in 1994 and Chief Executive Officer since May 1996.,Human,report4_LMT
40,"We expect spending in technology and content will increase over time as we add computer scientists, designers, software and hardware engineers, and merchandising employees.",Human,report4_LMT
441,"In addition, failure to optimize inventory in our fulfillment network increases our net shipping cost by requiring long-zone or partial shipments.",Financial,report4_LMT
177,"See Item 8 of Part II, “Financial Statements and Supplementary Data — Note 1 — Description of Business, Accounting Policies, and Supplemental Disclosures — Use of Estimates” for additional information on our change in estimated useful life of our servers.",Manufactured,report4_LMT
15,Changes in foreign exchange rates impacted operating income by $23 million and $8 million for 2019 and 2020.,Financial,report4_LMT
83,This operating cycle results in a corresponding increase in accounts payable as of December 31.,Financial,report4_LMT
36,"Our Annual Report on Form 10-K for the year ended December 31, 2019 includes a discussion and analysis of our financial condition and results of operations for the year ended December 31, 2018 in Item 7 of Part II, “Management’s Discussion and Analysis of Financial Condition and Results of Operations.”",Financial,report4_LMT
145,"(2)For the year ended December 31, 2019 and 2020, this amount relates to property included in “Principal repayments of finance leases” of $9,628 million and $10,642 million.",Financial,report4_LMT
181,"We seek to invest efficiently in numerous areas of technology and content so we may continue to enhance the customer experience and improve our process efficiency through rapid technology developments, while operating at an ever increasing scale.",Financial,report4_LMT
427,"Steps we take to add software and hardware, upgrade our systems and network infrastructure, and improve the stability and efficiency of our systems may not be sufficient to avoid system interruptions or delays that could adversely affect our operating results.",Intellectual,report4_LMT
121,We generally invest our excess cash in AAA-rated money market funds and investment grade short- to intermediate-term fixed income securities.,Financial,report4_LMT
184,"Technology and content costs include payroll and related expenses for employees involved in the research and development of new and existing products and services, development, design, and maintenance of our stores, curation and display of products and services made available in our online stores, and infrastructure costs.",Financial,report4_LMT
429,We Face Risks Related to System Interruption and Lack of Redundancy,Intellectual,report4_LMT
513,"The People’s Republic of China (“PRC”) and India regulate Amazon’s and its affiliates’ businesses and operations in country through regulations and license requirements that may restrict (i) foreign investment in and operation of the Internet, IT infrastructure, data centers, retail, delivery, and other sectors, (ii) Internet content, and (iii) the sale of media and other products and services.",Financial,report4_LMT
575,"We regard our trademarks, service marks, copyrights, patents, domain names, trade dress, trade secrets, proprietary technologies, and similar intellectual property as critical to our success, and we rely on trademark, copyright, and patent law, trade-secret protection, and confidentiality and/or license agreements with our employees, customers, partners, and others to protect our proprietary rights.",Intellectual,report4_LMT
230,"There can be no assurance that additional credit lines or financing instruments will be available in amounts or on terms acceptable to us, if at all.",Financial,report4_LMT
397,"Our Business Suffers When We Are Unsuccessful in Making, Integrating, and Maintaining Acquisitions and Investments",Financial,report4_LMT
41,"To decrease our variable costs on a per unit basis and enable us to lower prices for customers, we seek to increase our direct sourcing, increase discounts from suppliers, and reduce defects in our processes.",Financial,report4_LMT
232,The sale of additional equity or convertible debt securities would be dilutive to our shareholders.,Financial,report4_LMT
414,"Decisions by our current suppliers to limit or stop selling or licensing merchandise, content, components, or services to us on acceptable terms, or delay delivery, including as a result of one or more supplier bankruptcies due to poor economic conditions, as a result of natural disasters, or for other reasons, may result in our being unable to procure alternatives from other suppliers in a timely and efficient manner and on acceptable terms, or at all.",Social and relationship,report4_LMT
194,"We seek to mitigate costs of shipping over time in part through achieving higher sales volumes, optimizing our fulfillment network, negotiating better terms with our suppliers, and achieving better operating efficiencies.",Financial,report4_LMT
123,Our long-term debt is carried at amortized cost and fluctuations in interest rates do not impact our consolidated financial statements.,Financial,report4_LMT
403,"We may in the future enter into amendments on less favorable terms or encounter parties that have difficulty meeting their contractual obligations to us, which could adversely affect our operating results.",Social and relationship,report4_LMT
105,"As of December 31, 2020, our recorded value in equity and equity warrant investments in public and private companies was $6.9 billion.",Financial,report4_LMT
392,•additional operating losses and expenses of the businesses we acquired or in which we invested;,Financial,report4_LMT
143,"Additionally, our mix of property and equipment acquisitions with cash or other financing options may change over time.",Financial,report4_LMT
95,"Competition for qualified personnel has historically been intense, particularly for software engineers, computer scientists, and other technical staff.",Human,report4_LMT
183,"Infrastructure costs include servers, networking equipment, and data center related depreciation and amortization, rent, utilities, and other expenses necessary to support AWS and other Amazon businesses.",Financial,report4_LMT
187,We expect fulfillment costs as a percentage of net sales to continue to be negatively impacted through at least Q1 2021 by COVID-19 related costs.,Financial,report4_LMT
486,"We may be unable to prevent third parties from acquiring domain names that are similar to, infringe upon, or diminish the value of our trademarks and other proprietary rights.",Intellectual,report4_LMT
165,"Our long-term lease liabilities were $39.8 billion and $52.6 billion as of December 31, 2019 and 2020.",Financial,report4_LMT
49,"Actual results could differ materially for a variety of reasons, including, among others, fluctuations in foreign exchange rates, changes in global economic conditions and customer spending, world events, the rate of growth of the Internet, online commerce, and cloud services, the amount that Amazon.com invests in new business opportunities and the timing of those investments, the mix of products and services sold to customers, the mix of net sales derived from products as compared with services, the extent to which we owe income or other taxes, competition, management of growth, potential fluctuations in operating results, international growth and expansion, the outcomes of claims, litigation, government investigations, and other proceedings, fulfillment, sortation, delivery, and data center optimization, risks of inventory management, variability in demand, the degree to which we enter into, maintain, and develop commercial agreements, proposed and completed acquisitions and strategic transactions, payments risks, and risks of fulfillment throughput and productivity.",Financial,report4_LMT
454,"•the outcomes of legal proceedings and claims, which may include significant monetary damages or injunctive relief and could have a material adverse impact on our operating results;",Financial,report4_LMT
406,"Moreover, we may not be able to enter into additional or alternative commercial relationships and strategic alliances on favorable terms.",Social and relationship,report4_LMT
290,"Likewise, if the U.S. Dollar strengthens year-over-year relative to currencies in our international locations, our consolidated net sales and operating expenses will be lower than if currencies had remained constant.",Financial,report4_LMT
211,Changes in foreign currency exchange rates impacted International net sales by $(2.4) billion and $1.7 billion in 2019 and 2020.,Financial,report4_LMT
390,•the potential impairment of customer and other relationships of the company we acquired or in which we invested or our own customers as a result of any integration of operations;,Social and relationship,report4_LMT
23,"We made cash payments, net of acquired cash, related to acquisition and other investment activity of $2.5 billion and $2.3 billion in 2019 and 2020.",Financial,report4_LMT
591,"We fulfill customer orders in a number of ways, including through: North America and International fulfillment networks that we operate; co-sourced and outsourced arrangements in certain countries; digital delivery; and through our physical stores.",Social and relationship,report4_LMT
50,We Are Subject to Risks Related to Government Contracts and Related Procurement Regulations,Social and relationship,report4_LMT
477,"Breach or malfunctioning of the digital rights management technology that we use could subject us to claims, and content providers may be unwilling to include their content in our service.",Intellectual,report4_LMT
51,"Although we believe our tax estimates are reasonable, the final outcome of audits, investigations, and any other tax controversies could be materially different from our historical tax accruals.",Financial,report4_LMT
536,"Failure to realize the benefits of amounts we invest in new technologies, products, or services could result in the value of those investments being written down or written off.",Financial,report4_LMT
362,"If we were found to be in violation of applicable laws or regulations, we could be subject to additional requirements and civil and criminal penalties, or forced to cease providing certain services.",Financial,report4_LMT
109,"Fluctuations in fair value are recorded in “Accumulated other comprehensive income (loss),” a separate component of stockholders’ equity.",Financial,report4_LMT
242,"As of December 31, 2019 and 2020, restricted cash, cash equivalents, and marketable securities were $321 million and $257 million.",Financial,report4_LMT
302,1 The operating cycle is the number of days of sales in inventory plus the number of days of sales in accounts receivable minus accounts payable days.,Financial,report4_LMT
226,"As reflected in the discussion below, the impact of the COVID-19 pandemic and actions taken in response to it had varying effects on our 2020 results of operations.",Financial,report4_LMT
175,"We direct customers to our stores primarily through a number of marketing channels, such as our sponsored search, third party customer referrals, social and online advertising, television advertising, and other initiatives.",Social and relationship,report4_LMT
0,We assess our equity investments in private companies for impairment.,Financial,report4_LMT
156,"In addition, we record valuation allowances against deferred tax assets when there is uncertainty about our ability to generate future income in relevant jurisdictions, and the effects of the COVID-19 pandemic on our business make estimates of future income more challenging.",Financial,report4_LMT
254,"Property and equipment acquired under finance leases was $13.7 billion and $11.6 billion in 2019 and 2020, reflecting investments in support of continued business growth primarily due to investments in technology infrastructure for AWS.",Financial,report4_LMT
556,"Mr. Jassy has served as CEO Amazon Web Services since April 2016, and Senior Vice President, Amazon Web Services, from April 2006 until April 2016.",Human,report4_LMT
337,We Are Subject to Product Liability Claims When People or Property Are Harmed by the Products We Sell or Manufacture,Financial,report4_LMT
465,"A significant portion of our expenses and investments is fixed, and we are not always able to adjust our spending quickly enough if our sales are less than expected.",Financial,report4_LMT
176,"Marketing costs include advertising and payroll and related expenses for personnel engaged in marketing and selling activities, including sales commissions related to AWS.",Financial,report4_LMT
472,"Our Expansion Places a Significant Strain on our Management, Operational, Financial, and Other Resources",Financial,report4_LMT
553,Shelley L. Reynolds.,Human,report4_LMT
501,"If too many customers access our websites within a short period of time due to increased demand, we may experience system interruptions that make our websites unavailable or prevent us from efficiently fulfilling orders, which may reduce the volume of goods we offer or sell and the attractiveness of our products and services.",Intellectual,report4_LMT
482,"Moreover, the steps we take to protect our intellectual property do not always adequately protect our rights or prevent third parties from infringing or misappropriating our proprietary rights.",Intellectual,report4_LMT
168,Our interest income was $832 million and $555 million during 2019 and 2020.,Financial,report4_LMT
146,"(1)For the year ended December 31, 2019 and 2020, this amount relates to equipment included in “Property and equipment acquired under finance leases” of $13,723 million and $11,588 million.",Financial,report4_LMT
292,"Total shares outstanding plus outstanding stock awards were 512 million and 518 million as of December 31, 2019 and 2020.",Financial,report4_LMT
438,Our failure to properly handle such inventory or the inability of the other businesses on whose behalf we perform inventory fulfillment services to accurately forecast product demand may result in us being unable to secure sufficient storage space or to optimize our fulfillment network or cause other unexpected costs and other harm to our business and reputation.,Social and relationship,report4_LMT
505,"For example, we expect a disproportionate amount of our retail sales to occur during our fourth quarter.",Financial,report4_LMT
410,"Under these agreements, we provide web services, technology, fulfillment, computing, digital storage, and other services, as well as enable sellers to offer products or services through our stores.",Social and relationship,report4_LMT
306,"To minimize unnecessary growth in fixed costs, we seek to improve process efficiencies and maintain a lean culture.",Financial,report4_LMT
231,"In addition, we will, from time to time, consider the acquisition of, or investment in, complementary businesses, products, services, capital infrastructure, and technologies, which might affect our liquidity requirements or cause us to secure additional financing, or issue additional equity or debt securities.",Financial,report4_LMT
79,"We also hold cash equivalents and/or marketable securities in foreign currencies including Euros, British Pounds, and Japanese Yen.",Financial,report4_LMT
197,We expect cost of sales as a percentage of net sales to continue to be negatively impacted through at least Q1 2021 by COVID-19 related costs.,Financial,report4_LMT
203,Changes in foreign exchange rates impacted operating income (loss) by $(116) million and $411 million for 2019 and 2020.,Financial,report4_LMT
114,"The results of operations of, and certain of our intercompany balances associated with, our internationally-focused stores and AWS are exposed to foreign exchange rate fluctuations.",Financial,report4_LMT
193,"We believe that offering low prices to our customers is fundamental to our future success, and one way we offer lower prices is through shipping offers.",Financial,report4_LMT
284,"Beginning in Q1 2020, we made numerous process updates across our operations worldwide, and adapted our fulfillment network, to implement employee and customer safety measures, such as enhanced cleaning and physical distancing, personal protective gear, disinfectant spraying, and temperature checks.",Human,report4_LMT
323,We regularly assess the likelihood of an adverse outcome resulting from these proceedings to determine the adequacy of our tax accruals.,Financial,report4_LMT
119,"The following table provides information about our cash equivalents and marketable fixed income securities, including principal cash flows by expected maturity and the related weighted-average interest rates as of December 31, 2020 (in millions, except percentages):",Financial,report4_LMT
560,Mr. Bezos served as President of the Company from founding until June 1999 and again from October 2000 to the present.,Human,report4_LMT
