,text,capital,report
216,"Outside the United States, substantially all of the natural gas sales from the company’s producing interests are from operations in Angola, Argentina, Australia, Bangladesh, Canada, Kazakhstan, Indonesia, Israel, Myanmar, Nigeria and Thailand.",Natural,report2_CVX
48,"International agreements and national, regional, and state legislation and regulatory measures that aim to limit or reduce GHG emissions are currently in various stages of implementation.",Social and relationship,report2_CVX
282,Proved reserves have been recognized for the FGP/WPMP.,Natural,report2_CVX
174,"Chevron also maintains a role in the petrochemical business through the operations of GSC, the company’s 50 percent-owned affiliate.",Social and relationship,report2_CVX
278,"At the end of 2020, proved reserves had not been recognized for future expansion.",Natural,report2_CVX
517,Chevron believes its low voluntary attrition rate is in part a result of the company’s commitment to employee development and career advancement.,Human,report2_CVX
370,"The eight-well drilling program completed in third quarter 2020, and first oil was achieved in October 2020.",Natural,report2_CVX
158,"The organization conducts research, develops and qualifies technology, and provides technical services and competency development.",Social and relationship,report2_CVX
371,The company utilizes waterflood operations to mitigate declines at the operated El Trapial Field and continues to evaluate the potential of the Vaca Muerta Shale.,Natural,report2_CVX
68,"Our control of the general partner of Noble Midstream may increase the possibility that we could be subject to claims of breach of duties owed to Noble Midstream, including claims of conflict of interest.",Natural,report2_CVX
316,"In December 2020, the company signed an agreement to divest its 40 percent operated interest in OML 86 and OML 88.",Natural,report2_CVX
434,First injection is expected in 2023.,Manufactured,report2_CVX
522,"For instance, Chevron recently launched learning initiatives focused on digital innovation, including new Digital Academy and Digital Scholars programs.",Human,report2_CVX
195,"The company markets petroleum products under the principal brands of “Chevron,” “Texaco” and “Caltex” throughout many parts of the world.",Social and relationship,report2_CVX
363,Chevron holds a 40 percent-owned and operated working interest in the offshore Colombia-3 and Guajira Offshore-3 Blocks.,Natural,report2_CVX
78,"In certain situations where Chevron is not the operator, the company may have limited influence and control over third parties, which may limit its ability to manage and control such risks.",Natural,report2_CVX
183,"The company also markets an extensive line of lubricant and coolant products under the product names Havoline, Delo, Ursa, Meropa, Rando, Clarity and Taro in the United States and worldwide under the three brands: Chevron, Texaco and Caltex.",Social and relationship,report2_CVX
96,"In addition, extended periods of low commodity prices can have a material adverse impact on the results of operations, financial condition and liquidity of the company’s suppliers, vendors, partners and equity affiliates upon which the company’s own results of operations and financial condition depends.",Social and relationship,report2_CVX
288,"The FGP is designed to increase total daily production by about 260,000 barrels of crude oil and to expand the utilization of sour gas injection technology proven in existing operations to increase ultimate recovery from the reservoir.",Natural,report2_CVX
387,Chevron holds a 50 percent-owned and operated interest in Flemish Pass Basin Block EL 1138.,Natural,report2_CVX
198,"The company’s 60.6 percent-owned refinery in Map Ta Phut, Thailand, continues to supply high-quality petroleum products through the Caltex brand into regional markets.",Financial,report2_CVX
511,"Employee engagement is an indicator of employee well-being and commitment to the company’s values, purpose and strategies.",Human,report2_CVX
435,"The St. Malo Stage 4 waterflood project includes two new production wells, three injector wells, and topsides water injection equipment at the St. Malo field.",Natural,report2_CVX
87,"Although Chevron devotes significant resources to prevent unwanted intrusions and to protect its systems and data, whether such data is housed internally or by external third parties, the company has experienced and will continue to experience cyber incidents of varying degrees in the conduct of its business.",Manufactured,report2_CVX
510,Chevron regularly conducts employee surveys to assess the health of the company’s culture.,Human,report2_CVX
9,"At the refinery in Salt Lake City, Utah, construction continued on the alkylation retrofit project with more than 100 modules installed.",Manufactured,report2_CVX
150,"In 2020, OGCI committed to a Global Gas Flaring Explorer web platform and set a target for OGCI members to reduce oil and gas carbon intensity.",Natural,report2_CVX
404,"During 2020, the company participated in two exploration wells and one appraisal well in the deepwater Gulf of Mexico.",Natural,report2_CVX
211,"Operable capacity at December 31, 2020, and daily refinery inputs for 2018 through 2020 for the company and affiliate refineries are summarized in the table on the next page.",Financial,report2_CVX
295,"In Asia, the company is engaged in upstream activities in Kazakhstan, Russia, Bangladesh, Myanmar, Thailand, China and Indonesia.",Natural,report2_CVX
51,"Legislation, regulation, and other government actions related to greenhouse gas (GHG) emissions and climate change could continue to increase Chevron’s operational costs and reduce demand for Chevron’s hydrocarbon and other products Chevron may be challenged by a further increase in international and domestic legislation, regulation, or other government actions relating to GHG emissions and climate change.",Natural,report2_CVX
291,TCO is developing the Tengiz and Korolev crude oil fields in western Kazakhstan under a concession agreement that expires in 2033.,Social and relationship,report2_CVX
2,"As a result, the value of the company’s assets may also become impaired in future periods, as we saw in 2020.",Manufactured,report2_CVX
151,"Chevron continued its participation as a member of OGCI, a global collaboration focused on the industry’s efforts to take actions to accelerate and participate in a lower carbon future.",Social and relationship,report2_CVX
71,"Failure to realize anticipated synergies in the expected timeframe, operational challenges, the diversion of management’s attention from ongoing business concerns, and unforeseen expenses associated with the acquisition may have an adverse impact on our financial results.",Natural,report2_CVX
394,The company holds a 20 percent nonoperated working interest in the Athabasca Oil Sands Project (AOSP) in Alberta.,Natural,report2_CVX
496,"At December 31, 2020, 27 percent of the company’s net proved oil-equivalent reserves were located in the United States, 18 percent were located in Australia and 20 percent were located in Kazakhstan.",Natural,report2_CVX
39,"Consideration of climate change-related issues and the responses to those issues through international agreements and national, regional, or state legislation or regulations are integrated into the company’s strategy and planning, capital investment reviews, and risk management tools and processes, where applicable.",Social and relationship,report2_CVX
314,Quantitative data for Egypt can be found within the Africa geography throughout this document.,Manufactured,report2_CVX
298,Partitioned Zone Chevron holds a concession to oper ate the Kingdom of Saudi Arabia’s 50 percent interest in the hydrocarbon resources in the onshore area of the Partitioned Zone between Saudi Arabia and Kuwait.,Natural,report2_CVX
381,Chevron holds a 37.5 percent-owned and operated interest in Block 22 where reprocessing of 3-D seismic data continued in 2020.,Natural,report2_CVX
332,Nigeria Chevron operates and holds a 40 percent interest in eight concessions in the onshore and near-offshore regions of the Niger Delta.,Natural,report2_CVX
274, Bangladesh Chevron operates and holds a 100 percent interest in Block 12 (Bibiyana Field) and Blocks 13 and 14 (Jalalabad and Moulavi Bazar fields).,Natural,report2_CVX
232,Chevron holds an 80.2 percent interest in the offshore licenses and a 64.1 percent-owned and operated interest in the LNG facilities associated with the Wheatstone Project.,Financial,report2_CVX
228,"The total production capacity for the Wheatstone and Iago fields and nearby third-party fields is expected to be approximately 1.6 billion cubic feet of natural gas and 30,000 barrels of condensate per day.",Natural,report2_CVX
466,"The following table summarizes the company’s net interests in productive and dry exploratory wells completed in each of the last three years, and the number of exploratory wells drilling at December 31, 2020.",Natural,report2_CVX
204,Project start-up is expected in second quarter 2021.,Social and relationship,report2_CVX
238,"Chevron holds a 47.3 percent-owned and operated interest in the Gorgon Project, which includes the development of the Gorgon and Jansz-Io fields.",Manufactured,report2_CVX
424,"Chevron has a 60 percent-owned and operated interest in the Big Foot Project, located in the deepwater Walker Ridge area.",Natural,report2_CVX
31,"Increasing attention to climate change, for example, may result in demand shifts for our hydrocarbon products and additional governmental investigations and private litigation against the company.",Social and relationship,report2_CVX
275,"During 2020, CPC transported an average of 1.3 million barrels of crude oil per day, composed of 1.1 million barrels per day from Kazakhstan and 0.2 million barrels per day from Russia.",Natural,report2_CVX
366,Chevron holds between 30 to 45 percent of both operated and nonoperated interests in 11 blocks within the Campos and Santos basins.,Natural,report2_CVX
16,"Chevron hires, develops, and strives to retain critical talent, and fosters a culture that values diversity and inclusion and employee engagement, all of which support the company’s overall objective to deliver industry leading performance.",Social and relationship,report2_CVX
134,Many of these risks are not within the company’s control and could materially impact the company’s results of operations and financial condition.,Natural,report2_CVX
486,"The company estimates its average worldwide oil-equivalent production in 2021 will grow up to 3 percent compared to 2020, assuming a Brent crude oil price of $50 per barrel and excluding the impact of anticipated 2021 asset sales.",Natural,report2_CVX
132,"Impacts of the COVID-19 pandemic have resulted in a significant decrease in demand for Chevron’s products and caused a precipitous drop in commodity prices that has had, and may continue to have, an adverse and potentially material adverse effect on Chevron’s financial and operating results.",Financial,report2_CVX
519,"Chevron’s 2020 annual voluntary attrition was 4.1 percent, in line with its historical rates.",Human,report2_CVX
405,"At the end of 2020, proved reserves had not been recognized for these projects.",Natural,report2_CVX
482,"Refer to Table IV on page 102 for the company’s average sales price per barrel of liquids (including crude oil, condensate and natural gas liquids) and per thousand cubic feet of natural gas produced, and the average production cost per oil-equivalent barrel for 2020, 2019 and 2018.",Natural,report2_CVX
252,"The company operates and holds a 62 percent interest in two PSCs in the Kutei Basin (Rapak and Ganal), located offshore eastern Kalimantan.",Natural,report2_CVX
131,"As of the date of this Annual Report on Form 10-K, the economic, business, and oil and gas industry impacts from the COVID-19 pandemic and the disruption to capital markets have continued to be far reaching.",Financial,report2_CVX
219, The company sells natural gas and NGLs from its producing operations under a variety of contractual arrangements.,Natural,report2_CVX
527,Chevron recruits new employees through partnerships with universities and diversity associations.,Human,report2_CVX
507,"The survey results positively reinforced actions taken by Chevron, and helped inform further actions to address the impact on employees and their families through enhanced mental health and wellness support, financial assistance for unplanned childcare needs and remote learning resources, among other efforts.",Human,report2_CVX
346,"In October 2020, the Angolan government approved combining all development areas in Block 14, providing enhanced fiscal terms and extending the PSC expiration to 2028.",Intellectual,report2_CVX
177,"At the end of 2020, CPChem owned or had joint-venture interests in 28 manufacturing facilities and two research and development centers around the world.",Social and relationship,report2_CVX
242,Chevron is Australia's largest producer of LNG.,Financial,report2_CVX
37,"These forecasts reflect long-range effects from renewable fuel penetration, energy efficiency standards, climate change-related policy actions and demand response to oil and natural gas prices.",Natural,report2_CVX
89,"Cyberattacks targeting Chevron’s process control networks or other digital infrastructure could have a material adverse impact on the company’s business and results of operations There are numerous and evolving risks to Chevron’s cybersecurity and privacy from cyber threat actors, including criminal hackers, state-sponsored intrusions, industrial espionage and employee malfeasance.",Financial,report2_CVX
180,Commercial production is anticipated to begin in the second quarter 2021.,Social and relationship,report2_CVX
294,Acreage for Asia can be found in the table on page 7.,Natural,report2_CVX
534,"This includes reviews of metrics addressing critical function hiring, leadership development, attrition, diversity and inclusion, and employee engagement.",Human,report2_CVX
147,"Environmental Protection The company designs, operates and maintains its facilities to avoid potential spills or leaks and to minimize the impact of those that may occur.",Manufactured,report2_CVX
455,"With the acquisition of Noble in October 2020, Chevron increased its position in the Permian Basin and acquired acreage in Colorado and Wyoming.",Natural,report2_CVX
92,"The company’s operations are therefore subject to disruption from natural or human causes beyond its control, including risks from hurricanes, severe storms, floods, heat waves, other forms of severe weather, wildfires, ambient temperature increases, sea level rise, war, accidents, civil unrest, political events, fires, earthquakes, system failures, cyber threats, terrorist acts and epidemic or pandemic diseases such as the COVID-19 pandemic, any of which could result in suspension of operations or harm to people or the natural environment.",Natural,report2_CVX
418,Proved reserves have been recognized for this project.,Natural,report2_CVX
269,"Thailand Chevron holds operated interests in the Pattani Basin, located in the Gulf of Thailand, with ownership ranging from 35 percent to 80 percent.",Natural,report2_CVX
61,"For example, liability or delays could result from an accidental, unlawful discharge or from new conclusions about the effects of the company’s operations on human health or the environment.",Natural,report2_CVX
11,"In April 2020, drilling and completion activity was halted due to the COVID-19 pandemic at the nonoperated Loma Campana concession in the Vaca Muerta Shale.",Social and relationship,report2_CVX
265,Concessions for the producing areas within this basin expire between 2036 and 2040.,Social and relationship,report2_CVX
271,The PSC expires in 2028.,Intellectual,report2_CVX
502,"Similar comparative data for the company’s investments in and income from equity affiliates and property, plant and equipment are in Note 13 beginning on page 77 and Note 16 on page 82.",Natural,report2_CVX
143,"To complement the company’s capabilities, Chevron maintains active membership in international oil spill response cooperatives, including the Marine Spill Response Corporation, which operates in U.S. territorial waters, and Oil Spill Response, Ltd., which operates globally.",Social and relationship,report2_CVX
325,"The leases that contain the Usan and Agbami Fields expire in 2023 and 2024, respectively.",Natural,report2_CVX
380,"The company also holds a 40 percent nonoperated interest in Blocks 20, 21 and 23 in the Cuenca Salina area in the deepwater Gulf of Mexico.",Natural,report2_CVX
144,"In the unlikely event that a major spill or leak occurs, Chevron also maintains a Worldwide Emergency Response Team comprised of employees who are trained in various aspects of emergency response, including post-incident remediation.",Intellectual,report2_CVX
457,Acreage for the United States can be found in the table on page 7.,Manufactured,report2_CVX
41,Indirect regulation of GHG emissions could include bans or restrictions on technologies that use the company’s hydrocarbon products.,Social and relationship,report2_CVX
168,"Pipelines Chevron owns and operates a network of crude oil, natural gas and product pipelines and other infrastructure assets in the United States.",Social and relationship,report2_CVX
352,Acreage for Africa can be found in the table on page 7.,Natural,report2_CVX
508,"In 2020, the company’s employee survey focused on the COVID-19 impact on employee well-being and the company’s response to the pandemic.",Human,report2_CVX
512,"In addition, Chevron has twelve employee networks (voluntary groups of employees that come together based on shared identity or interests) and more than fifteen diversity councils across its business units that help align diversity and inclusion efforts with business strategies.",Human,report2_CVX
208,Chevron processes both imported and domestic crude oil in its U.S. refining operations.,Financial,report2_CVX
318,Chevron also holds a 27 percent interest in adjacent licenses OML 139 and OML 154.,Natural,report2_CVX
525,"In addition, the company recruits experienced hires to target critical skills.",Human,report2_CVX
345,"Chevron has a 36.4 percent interest in Angola LNG Limited, which operates an onshore natural gas liquefaction plant in Soyo, Angola.",Natural,report2_CVX
155,"Chevron’s Technology Ventures (CTV) unit identifies and integrates externally developed technologies and new business solutions with the potential to enhance the way Chevron produces and delivers affordable, reliable, and ever-cleaner energy.",Social and relationship,report2_CVX
159,"These vessels transport crude oil, LNG, refined products and feedstock in support of the company’s global upstream and downstream businesses.",Manufactured,report2_CVX
501,Refer to page 44 of this Form 10-K in Management’s Discussion and Analysis of Financial Condition and Results of Operations for a discussion of the company’s capital and exploratory expenditures.,Financial,report2_CVX
213,Refer also to “Delivery Commitments” beginning on page 7 for information related to the company’s delivery commitments for the sale of crude oil and natural gas.,Natural,report2_CVX
372,Chevron also owns and operates a 100 percent interest in the El Trapial Field with both conventional production and Vaca Muerta Shale potential.,Natural,report2_CVX
84,"Further, the company has exposure to cyber incidents and the negative impacts of such incidents related to its critical data and proprietary information housed on third-party IT systems, including the cloud.",Social and relationship,report2_CVX
222,"Chevron owns and operates the Clio, Acme and Acme West fields.",Natural,report2_CVX
225,"In June 2020, Chevron announced the decision to market its share in the NWS Venture with the data room opening in September 2020.",Financial,report2_CVX
361,Suriname Chevron holds a 33.3 percent nonoperated working interest in deepwater Block 42.,Natural,report2_CVX
140,The company is committed to improving energy efficiency in its day-to-day operations and is required to comply with the greenhouse gas-related laws and regulations to which it is subject.,Social and relationship,report2_CVX
153,"In addition to the company’s own managed funds, Chevron also makes",Natural,report2_CVX
409,"At the end of 2020, no proved reserves were recognized for this project.",Natural,report2_CVX
190,The company markets in Latin America using the Texaco brand.,Social and relationship,report2_CVX
105,Chevron evaluates the risk of changing commodity prices as a core part of its business planning process.,Manufactured,report2_CVX
130,"Crude oil prices, the single largest variable that affects the company’s results of operations, fell to historic lows, even briefly going negative, due to a combination of a severely reduced demand for crude oil, gasoline, jet fuel, diesel fuel, and other refined products resulting from government-mandated travel restrictions and the curtailment of economic activity resulting from the COVID-19 pandemic.",Natural,report2_CVX
536,Chevron is focused on investing in its employees and its culture.,Human,report2_CVX
335,Equatorial Guinea Chevron has a 38 percent-owned and operated interest in the Aseng oil field and the Yolanda natural gas field in Block I and a 45 percent-owned and operated interest in Alen natural gas and condensate field in Block O.,Natural,report2_CVX
160,"The operated fleet consists of conventional crude tankers, product carriers and LNG carriers.",Manufactured,report2_CVX
533,"The following table summarizes Chevron’s number of employees by gender, where data is available, and by region as of December 31, 2020.",Human,report2_CVX
518,The voluntary attrition rate generally excludes employee departures under enterprise-wide restructuring programs.,Human,report2_CVX
506,"The company also has long-standing programs such as Ombuds, an independent resource designed to equip employees with options to address and resolve workplace issues; a company hotline, where employees can report concerns to the Corporate Compliance department; and its Employee Assistance Program, a confidential consulting service that can help employees resolve a broad range of personal, family and work-related concerns or problems.",Human,report2_CVX
240,Net daily oil-equivalent production can be found in the table on page 6.,Financial,report2_CVX
166,The company also has direct and indirect interests in other U.S. and international pipelines.,Financial,report2_CVX
414,The field has an estimated production life of 30 years.,Natural,report2_CVX
217,"During 2020, U.S. and international sales of natural gas averaged 3.9 billion and 5.6 billion cubic feet per day, respectively, which includes the company’s share of equity affiliates’ sales.",Natural,report2_CVX
549,"In its downstream business, Chevron competes with fully integrated, major petroleum companies, as well as independent refining and marketing, transportation and chemicals entities and national petroleum companies in the refining, manufacturing, sale and marketing of fuels, lubricants, additives and petrochemicals.",Social and relationship,report2_CVX
393,"Oil sands are mined from both the Muskeg River and the Jackpine mines, and bitumen is extracted from the oil sands and upgraded into synthetic oil.",Natural,report2_CVX
176,CPChem holds a 51 percent interest in the US Gulf Coast II Petrochemical Project (USGC II) and a 30 percent interest in the Ras Laffan Petrochemical Project (RLPP) in Qatar.,Social and relationship,report2_CVX
425,Proved reserves have been recognized for the Mad Dog 2 Project.,Natural,report2_CVX
292,Kazakhstan Chevron has a 50 percent interest in the Tengizchevroil (TCO) affiliate and an 18 percent nonoperated working interest in the Karachaganak Field.,Natural,report2_CVX
239,"Upstream activities in Australia are concentrated offshore Western Australia, where the company is the operator of two major LNG projects, Gorgon and Wheatstone, and has a nonoperated working interest in the North West Shelf (NWS) Venture and exploration acreage in the Carnarvon Basin.",Natural,report2_CVX
35,"The ultimate effect of international agreements; national, regional, and state legislation and regulation; and government actions related to GHG emissions and climate change on the company’s financial performance, and the timing of these effects, will depend on a number of factors.",Social and relationship,report2_CVX
164,Noble Midstream is primarily focused in the DJ Basin in Colorado and Delaware Basin in Texas providing services to Chevron and third-party customers.,Social and relationship,report2_CVX
446,Chevron’s integrated development plan provides an opportunity to efficiently produce these resources.,Manufactured,report2_CVX
374,"During 2020, 17 horizontal wells were drilled.",Natural,report2_CVX
264,"Within the Pattani Basin the company holds ownership ranging from 70 to 80 percent of the Erawan concession, which expires in April 2022.",Social and relationship,report2_CVX
95,"The scope of Chevron’s business will decline if the company does not successfully develop resources The company is in an extractive business; therefore, if it is not successful in replacing the crude oil and natural gas it produces with good prospects for future organic opportunities or through acquisitions, the company’s business will decline.",Natural,report2_CVX
386,"The company also holds a 25 percent nonoperated working interest in blocks EL 1145, EL 1146 and EL 1148 and a 40 percent nonoperated working interest in EL 1149.",Natural,report2_CVX
